<?xml version="1.0" encoding="UTF-8"?>
<xs:schema xmlns:xs="http://www.w3.org/2001/XMLSchema">

<!-- XML Schema divided -->

<!-- Definition einfache Elemente mit Restrictions -->
<xs:element name="Rezeptname">
  <xs:simpleType>
    <xs:restriction base="xs:string">
      <xs:minLength value="5"/>
      <xs:maxLength value="50"/>
    </xs:restriction>
  </xs:simpleType>
</xs:element>

<xs:element name="Kurzinfo">
  <xs:simpleType>
    <xs:restriction base="xs:string">
      <xs:minLength value="20"/>
      <xs:maxLength value="200"/>
    </xs:restriction>
  </xs:simpleType>
</xs:element>

<xs:element name="Zutatname">
  <xs:simpleType>
    <xs:restriction base="xs:string">
      <xs:maxLength value="40"/>
    </xs:restriction>
  </xs:simpleType>
</xs:element>

<xs:element name="Menge">
  <xs:simpleType>
    <xs:restriction base="xs:decimal">
      <xs:minExclusive value="0"/>
      <xs:maxInclusive value="1000"/>
    </xs:restriction>
  </xs:simpleType>
</xs:element>

<xs:element name="Schwierigkeitsgrad">
  <xs:simpleType>
    <xs:restriction base="xs:string">
      <xs:enumeration value="simpel"/>
      <xs:enumeration value="normal"/>
      <xs:enumeration value="pfiffig"/>
    </xs:restriction>
  </xs:simpleType>
</xs:element>
<xs:element name="Beschreibung" type="xs:string"/>
<xs:element name="Arbeitszeit" type="xs:string"/>
<xs:element name="Ruhezeit" type="xs:string"/>
<xs:element name="Koch-Backzeit" type="xs:string"/>
<xs:element name="Brennwert" type="xs:string"/>



<!-- Definition Attribute -->
<xs:attribute name="url" type="xs:string"/>
<xs:attribute name="rezeptid" type="xs:integer"/>
<xs:attribute name="kategorie" type="xs:string"/>
<xs:attribute name="bildbeschreibung" type="xs:string"/>
<xs:attribute name="mengeneinheit" type="xs:string" default="0"/>
<xs:attribute name="bildquelle" type="xs:string"/>


<xs:attribute name="portionen">
  <xs:simpleType>
    <xs:restriction base="xs:integer">
      <xs:minExclusive value="0"/>
      <xs:maxInclusive value="50"/>
    </xs:restriction>
  </xs:simpleType>
</xs:attribute>


<!-- Definition komplexe Elemente -->

<!-- Wurzelelement -->
<xs:element name="Rezepteseite">
  <xs:complexType>
    <xs:sequence>
      <xs:element ref="Rezept" maxOccurs="unbounded"/>
    </xs:sequence>
  </xs:complexType>
</xs:element>


<!-- einzelnes Rezept -->
<xs:element name="Rezept">
  <xs:complexType>
    <xs:sequence>
      <xs:element ref="Rezeptname"/>
      <xs:element ref="Kurzinfo" minOccurs="0"/>
      <xs:element ref="Bilder" minOccurs="0"/>
      <xs:element ref="Zutaten"/>
      <xs:element ref="Zubereitung"/>
	</xs:sequence>   	
<xs:attribute ref="rezeptid" use="required"/>
    <xs:attribute ref="kategorie" use="required"/>
    <xs:attribute ref="url"/>
  </xs:complexType>
</xs:element>


<!-- Bilder -->
<xs:element name="Bilder">
  <xs:complexType>
    <xs:sequence>
      <xs:element ref="Bild" maxOccurs="unbounded"/>
    </xs:sequence>
  </xs:complexType>
</xs:element>

<xs:element name="Bild">
  <xs:complexType>
  	<xs:attribute ref="bildbeschreibung" use="required"/>
    <xs:attribute ref="bildquelle" use="required"/>
  </xs:complexType>
</xs:element>


<!-- Zutaten -->
<xs:element name="Zutaten">
  <xs:complexType>
    <xs:sequence>
      <xs:element ref="Zutat" minOccurs="1" maxOccurs="unbounded"/>
    </xs:sequence>
    <xs:attribute ref="portionen" use="required"/>
  </xs:complexType>
</xs:element>

<!-- einzelne Zutat mit zugehÃ¶rigen Informationen -->
<xs:element name="Zutat">
  <xs:complexType>
    <xs:sequence>
      <xs:element ref="Zutatname"/>
      <xs:element ref="Menge"/>
    </xs:sequence>
    <xs:attribute ref="mengeneinheit" use="required"/>
  </xs:complexType>
</xs:element>


<!-- Zubereitung -->
<xs:element name="Zubereitung">
  <xs:complexType>
    <xs:sequence>
      <xs:element ref="Arbeitszeit"/>
      <xs:element ref="Schwierigkeitsgrad"/>
      <xs:element ref="Brennwert"/>
      <xs:element ref="Ruhezeit" minOccurs="0"/>
      <xs:element ref="Koch-Backzeit" minOccurs="0"/>
      <xs:element ref="Beschreibung"/>
    </xs:sequence>
  </xs:complexType>
</xs:element>



</xs:schema>





